icd9_code,short_title,long_title
5830,Proliferat nephritis NOS,"Nephritis and nephropathy, not specified as acute or chronic, with lesion of proliferative glomerulonephritis"
38870,Otalgia NOS,"Otalgia, unspecified"
2362,Unc behav neo ovary,Neoplasm of uncertain behavior of ovary
20287,Lymphomas NEC spleen,"Other malignant lymphomas, spleen"
80316,Cl skull fx NEC-coma NOS,"Other closed skull fracture with cerebral laceration and contusion, with loss of consciousness of unspecified duration"
32351,Enceph/myel folwg immune,Encephalitis and encephalomyelitis following immunization procedures
78442,Dysphonia,Dysphonia
33812,Acute post-thoracot pain,Acute post-thoracotomy pain
73006,Ac osteomyelitis-l/leg,"Acute osteomyelitis, lower leg"
00863,Int inf norwalk virus,Enteritis due to norwalk virus
99689,Comp oth organ transplnt,Complications of other specified transplanted organ
2462,Cyst of thyroid,Cyst of thyroid
3207,Mening in oth bact dis,Meningitis in other bacterial diseases classified elsewhere
74489,Cong face/neck anom NEC,Other specified congenital anomalies of face and neck
5560,Ulcerative enterocolitis,Ulcerative (chronic) enterocolitis
36213,Retinal vascular changes,Changes in vascular appearance of retina
V1389,Hx diseases NEC,Personal history of other specified diseases
7593,Situs inversus,Situs inversus
81242,"Fx humer, lat condyl-cl",Closed fracture of lateral condyle of humerus
V703,Med exam NEC-admin purp,Other general medical examination for administrative purposes
25023,DMI hprosmlr uncontrold,"Diabetes with hyperosmolarity, type I [juvenile type], uncontrolled"
28809,Neutropenia NEC,Other neutropenia
8411,Sprain ulnar collat lig,Ulnar collateral ligament sprain
80441,Cl skl w oth fx w/o coma,"Closed fractures involving skull or face with other bones, with intracranial injury of other and unspecified nature, with no loss of consciousness"
80141,Cl skul base fx w/o coma,"Closed fracture of base of skull with intracranial injury of other and unspecified nature, with no loss of consciousness"
30723,Tourette's disorder,Tourette's disorder
83906,Disloc 6th cerv vert-cl,"Closed dislocation, sixth cervical vertebra"
80710,Fracture rib NOS-open,"Open fracture of rib(s), unspecified"
58081,Ac nephritis in oth dis,Acute glomerulonephritis in diseases classified elsewhere
99801,"Postop shock,cardiogenic","Postoperative shock, cardiogenic"
99641,Mech loosening pros jt,Mechanical loosening of prosthetic joint
37909,Scleritis NEC,Other scleritis and episcleritis
38200,Ac supp otitis media NOS,Acute suppurative otitis media without spontaneous rupture of eardrum
7601,Matern urine dis aff NB,Maternal renal and urinary tract diseases affecting fetus or newborn
66511,Rupture uterus NOS-deliv,"Rupture of uterus during labor, delivered, with or without mention of antepartum condition"
9043,Injury saphenous vein,Injury to saphenous veins
9048,Injury leg vessel NOS,Injury to unspecified blood vessel of lower extremity
70900,"Dyschromia, unspecified","Dyschromia, unspecified"
7592,Endocrine anomaly NEC,Anomalies of other endocrine glands
5982,Postop urethral strictur,Postoperative urethral stricture
37924,Vitreous opacities NEC,Other vitreous opacities
36570,Glaucoma stage NOS,"Glaucoma stage, unspecified"
43881,Late eff CV dis-apraxia,"Other late effects of cerebrovascular disease, apraxia"
36523,Chr angle-clos glaucoma,Chronic angle-closure glaucoma
5670,Peritonitis in infec dis,Peritonitis in infectious diseases classified elsewhere
1723,Mal melanom face NEC/NOS,Malignant melanoma of skin of other and unspecified parts of face
74861,Congen bronchiectasis,Congenital bronchiectasis
29644,Bipol I manic-sev w psy,"Bipolar I disorder, most recent episode (or current) manic, severe, specified as with psychotic behavior"
28412,Oth drg indcd pancytopna,Other drug-induced pancytopenia
8851,Amputation thumb-compl,"Traumatic amputation of thumb (complete)(partial), complicated"
2386,Plasmacytoma NOS,Neoplasm of uncertain behavior of plasma cells
37482,Edema of eyelid,Edema of eyelid
E8188,Mv traff acc-pers NEC,Other noncollision motor vehicle traffic accident injuring other specified person
1630,Mal neo parietal pleura,Malignant neoplasm of parietal pleura
75612,Spondylolisthesis,Spondylolisthesis
83652,Post disl prox tibia-cl,"Posterior dislocation of tibia, proximal end, closed"
78831,Urge incontinence,Urge incontinence
88023,Open wnd up arm w tendon,"Open wound of upper arm, with tendon involvement"
9278,Mult crushing injury arm,Crushing injury of multiple sites of upper limb
83200,Dislocat elbow NOS-close,"Closed dislocation of elbow, unspecified"
74322,Buphthal w oth eye anom,Buphthalmos associated with other ocular anomalies
84209,Sprain of wrist NEC,Other sprains and strains of wrist
V175,Family hx-asthma,Family history of asthma
E8703,Acc cut/hem in injection,"Accidental cut, puncture, perforation or hemorrhage during injection or vaccination"
V1504,Hx-seafood allergy,Allergy to seafood
0622,East equine encephalitis,Eastern equine encephalitis
73629,Acq finger deformity NEC,Other acquired deformities of finger
4531,Thrombophlebitis migrans,Thrombophlebitis migrans
74441,Branch cleft sinus/fistu,Branchial cleft sinus or fistula
7590,Anomalies of spleen,Anomalies of spleen
75019,Tongue anomaly NEC,Other congenital anomalies of tongue
81381,Fx radius NOS-closed,Closed fracture of unspecified part of radius (alone)
1712,Mal neo soft tissue arm,"Malignant neoplasm of connective and other soft tissue of upper limb, including shoulder"
6200,Follicular cyst of ovary,Follicular cyst of ovary
1718,Mal neo soft tissue NEC,Malignant neoplasm of other specified sites of connective and other soft tissue
9631,Pois-antineopl/immunosup,Poisoning by antineoplastic and immunosuppressive drugs
67404,Cerebrovasc dis-postpart,"Cerebrovascular disorders in the puerperium, postpartum condition or complication"
67204,Puerp pyrexia-postpartum,"Pyrexia of unknown origin during the puerperium, postpartum condition or complication"
V5399,Fit/adjust device NEC,"Fitting and adjustment, other device"
7768,Transient hemat dis NEC,Other specified transient hematological disorders of fetus or newborn
81243,"Fx humer, med condyl-cl",Closed fracture of medial condyle of humerus
48281,Pneumonia anaerobes,Pneumonia due to anaerobes
6805,Carbuncle of buttock,Carbuncle and furuncle of buttock
7871,Heartburn,Heartburn
34211,Spstc hmiplga domnt side,Spastic hemiplegia and hemiparesis affecting dominant side
34581,Epilepsy NEC w intr epil,"Other forms of epilepsy and recurrent seizures, with intractable epilepsy"
36812,Transient visual loss,Transient visual loss
36641,Diabetic cataract,Diabetic cataract
52469,Other specf TMJ disordrs,Other specified temporomandibular joint disorders
7859,Cardiovas sys symp NEC,Other symptoms involving cardiovascular system
6164,Abscess of vulva NEC,Other abscess of vulva
2166,Benign neo skin arm,"Benign neoplasm of skin of upper limb, including shoulder"
30181,Narcissistic personality,Narcissistic personality disorder
86355,Rectum injury-open,"Injury to rectum, with open wound into cavity"
8795,Opn wnd lat abdomen-comp,"Open wound of abdominal wall, lateral, complicated"
8787,Open wound vagina-compl,"Open wound of vagina, complicated"
8785,Open wound vulva-compl,"Open wound of vulva, complicated"
78837,Continuous leakage,Continuous leakage
80470,Opn skl/oth fx/menin hem,"Open fractures involving skull or face with other bones with subarachnoid, subdural, and extradural hemorrhage, unspecified state of consciousness"
49381,Exercse ind bronchospasm,Exercise induced bronchospasm
V172,Fam hx-neurolog dis NEC,Family history of other neurological diseases
4611,Ac frontal sinusitis,Acute frontal sinusitis
9912,Frostbite of foot,Frostbite of foot
E851,Acc poison-barbiturates,Accidental poisoning by barbiturates
E8110,Reentrant mv coll-driver,Motor vehicle traffic accident involving re-entrant collision with another motor vehicle injuring driver of motor vehicle other than motorcycle
85106,Cortex contus-coma NOS,"Cortex (cerebral) contusion without mention of open intracranial wound, with loss of consciousness of unspecified duration"
6073,Priapism,Priapism
30481,Comb drug dep NEC-contin,"Combinations of drug dependence excluding opioid type drug, continuous"
6970,Lichen planus,Lichen planus
36510,Open-angle glaucoma NOS,"Open-angle glaucoma, unspecified"
80603,C1-c4 fx-cl/cen cord syn,Closed fracture of C1-C4 level with central cord syndrome
E8797,Abn react-blood sampling,"Blood sampling as the cause of abnormal reaction of patient, or of later complication, without mention of misadventure at time of procedure"
04103,Streptococcus group c,"Streptococcus infection in conditions classified elsewhere and of unspecified site, streptococcus, group C"
80085,Opn skl vlt fx-deep coma,"Open fracture of vault of skull with other and unspecified intracranial hemorrhage, with prolonged [more than 24 hours] loss of consciousness, without return to pre-existing conscious level"
71155,Viral arthritis-pelvis,"Arthropathy associated with other viral diseases, pelvic region and thigh"
78933,Abdmnal mass rt lwr quad,"Abdominal or pelvic swelling, mass, or lump, right lower quadrant"
73012,Chr osteomyelit-up/arm,"Chronic osteomyelitis, upper arm"
7595,Tuberous sclerosis,Tuberous sclerosis
5253,Retained dental root,Retained dental root
2325,Ca in situ skin trunk,"Carcinoma in situ of skin of trunk, except scrotum"
13101,Trichomonal vaginitis,Trichomonal vulvovaginitis
78262,Flushing,Flushing
E8353,Wtrcraft fall NOS-pasngr,Other and unspecified fall in water transport injuring occupant of other watercraft -- other than crew
V1589,Hx-health hazards NEC,Other specified personal history presenting hazards to health
7634,Cesarean delivery aff NB,Cesarean delivery affecting fetus or newborn
2370,Unc behav neo pituitary,Neoplasm of uncertain behavior of pituitary gland and craniopharyngeal duct
1710,Mal neo soft tissue head,"Malignant neoplasm of connective and other soft tissue of head, face, and neck"
1638,Malig neopl pleura NEC,Malignant neoplasm of other specified sites of pleura
75440,Cong genu recurvatum,Genu recurvatum
85210,Subarach hem w opn wound,"Subarachnoid hemorrhage following injury with open intracranial wound, unspecified state of consciousness"
71990,Joint dis NOS-unspec jt,"Unspecified disorder of joint, site unspecified"
79401,Abnorm echoencephalogram,Nonspecific abnormal echoencephalogram
35579,Oth mononeur lower limb,Other mononeuritis of lower limb
1452,Malig neo hard palate,Malignant neoplasm of hard palate
1602,Mal neo maxillary sinus,Malignant neoplasm of maxillary sinus
37603,Orbital osteomyelitis,Orbital osteomyelitis
81332,Fx ulna shaft-open,Open fracture of shaft of ulna (alone)
5361,Ac dilation of stomach,Acute dilatation of stomach
67311,Amniotic embolism-deliv,"Amniotic fluid embolism, delivered, with or without mention of antepartum condition"
66811,Heart compl in del-deliv,"Cardiac complications of anesthesia or other sedation in labor and delivery, delivered, with or without mention of antepartum condition"
8710,Ocular lac w/o prolapse,Ocular laceration without prolapse of intraocular tissue
8716,Penetrat FB NEC eye,Penetration of eyeball with (nonmagnetic) foreign body
90450,Injury tibial vessel NOS,"Injury to tibial vessel(s), unspecified"
83660,Dislocat knee NOS-open,"Dislocation of knee, unspecified, open"
74923,Bilat clft palat/lip-com,"Cleft palate with cleft lip, bilateral, complete"
36811,Sudden visual loss,Sudden visual loss
38582,Cholesterin granuloma,Cholesterin granuloma of middle ear and mastoid
E8769,Medical misadventure NOS,Unspecified misadventure during medical care
8418,Sprain elbow/forearm NEC,Sprains and strains of other specified sites of elbow and forearm
6269,Menstrual disorder NOS,Unspecified disorders of menstruation and other abnormal bleeding from female genital tract
71432,Pauciart juv rheum arthr,Pauciarticular juvenile rheumatoid arthritis
0979,Syphilis NOS,"Syphilis, unspecified"
71515,Loc prim osteoart-pelvis,"Osteoarthrosis, localized, primary, pelvic region and thigh"
00861,Intes infec rotavirus,Enteritis due to rotavirus
71226,Pyrophosph cryst-l/leg,"Chondrocalcinosis, due to pyrophosphate crystals, lower leg"
7851,Palpitations,Palpitations
6149,Fem pelv inflam dis NOS,Unspecified inflammatory disease of female pelvic organs and tissues
30543,"Sed,hyp,anxiolytc ab-rem","Sedative, hypnotic or anxiolytic abuse, in remission"
85203,Subarach hem-mod coma,"Subarachnoid hemorrhage following injury without mention of open intracranial wound, with moderate [1-24 hours] loss of consciousness"
66524,Invers uterus-postpart,"Inversion of uterus, postpartum condition or complication"
0859,Leishmaniasis NOS,"Leishmaniasis, unspecified"
77087,NB respiratory arrest,Respiratory arrest of newborn
V558,Attn to artif open NEC,Attention to other specified artificial opening
67333,Ob pyemic embol-antepart,"Obstetrical pyemic and septic embolism, antepartum condition or complication"
64403,Thrt prem labor-antepart,"Threatened premature labor, antepartum condition or complication"
V167,Fam hx-lymph neoplas NEC,Family history of other lymphatic and hematopoietic neoplasms
7014,Keloid scar,Keloid scar
2652,Pellagra,Pellagra
V430,Eye replacement NEC,Eye globe replaced by other means
V1559,Hx injury NEC,Personal history of other injury
37140,Corneal degeneration NOS,"Corneal degeneration, unspecified"
36003,Chronic endophthalmitis,Chronic endophthalmitis
86512,Spleen capsular tear-opn,"Injury to spleen with open wound into cavity, capsular tears, without major disruption of parenchyma"
94522,2nd deg burn foot,"Blisters, epidermal loss [second degree] of foot"
E9242,Acc-hot tap water,Accident caused by hot (boiling) tap water
88111,Open wound elbow-complic,"Open wound of elbow, complicated"
V4989,Conditn influ health NEC,Other specified conditions influencing health status
73002,Ac osteomyelitis-up/arm,"Acute osteomyelitis, upper arm"
3789,Eye movemnt disorder NOS,Unspecified disorder of eye movements
7439,Eye anomaly NOS,Unspecified anomaly of eye
94420,2nd deg burn hand NOS,"Blisters, epidermal loss [second degree] of hand, unspecified site"
86130,Lung injury NOS-open,Unspecified injury of lung with open wound into thorax
87350,Open wnd face NOS-compl,"Open wound of face, unspecified site, complicated"
E9019,Excessive cold NOS,Accident due to excessive cold of unspecified origin
99580,Adult maltreatment NOS,"Adult maltreatment, unspecified"
E9673,Batter by spouse/partner,"Perpetrator of child and adult abuse, by spouse or partner"
20003,Reticulosarcoma abdom,"Reticulosarcoma, intra-abdominal lymph nodes"
71489,Inflamm polyarthrop NEC,Other specified inflammatory polyarthropathies
81202,Fx anatom nck humerus-cl,Closed fracture of anatomical neck of humerus
8469,Sprain sacroiliac NOS,Sprain of unspecified site of sacroiliac region
V1552,Hx traumatc brain injury,Personal history of traumatic brain injury
95203,Central cord synd/c1-c4,C1-C4 level with central cord syndrome
V5863,Lng use antiplte/thrmbtc,Long-term (current) use of antiplatelet/antithrombotic
1726,Malig melanoma arm,"Malignant melanoma of skin of upper limb, including shoulder"
94332,3rd deg burn elbow,"Full-thickness skin loss [third degree, not otherwise specified] of elbow"
94234,3rd deg burn back,"Full-thickness skin loss [third degree,not otherwise specified] of back [any part]"
V6282,"Bereavement, uncomplicat","Bereavement, uncomplicated"
95893,Trauma compart synd abd,Traumatic compartment syndrome of abdomen
74910,Cleft lip NOS,"Cleft lip, unspecified"
80175,Op skl base fx-deep coma,"Open fracture of base of skull with subarachnoid, subdural, and extradural hemorrhage, with prolonged [more than 24 hours] loss of consciousness, without return to pre-existing conscious level"
9710,Pois-parasympathomimetic,Poisoning by parasympathomimetics (cholinergics)
2360,Uncert behav neo uterus,Neoplasm of uncertain behavior of uterus
4480,Heredit hemorr telangiec,Hereditary hemorrhagic telangiectasia
73672,Acq equinus deformity,"Equinus deformity of foot, acquired"
79509,Abn pap cervix HPV NEC,Other abnormal Papanicolaou smear of cervix and cervical HPV
0794,Human papillomavirus,Human papillomavirus in conditions classified elsewhere and of unspecified site
62210,Dysplasia of cervix NOS,"Dysplasia of cervix, unspecified"
V6111,Cnsl victm partner abuse,Counseling for victim of spousal and partner abuse
7908,Viremia NOS,"Viremia, unspecified"
95202,Anterior cord synd/c1-c4,C1-C4 level with anterior cord syndrome
80602,C1-c4 fx-cl/ant cord syn,Closed fracture of C1-C4 level with anterior cord syndrome
7068,Sebaceous gland dis NEC,Other specified diseases of sebaceous glands
27489,Gout w manifestation NEC,Gout with other specified manifestations
64204,Essen hyperten-postpart,"Benign essential hypertension complicating pregnancy, childbirth, and the puerperium, postpartum condition or complication"
85131,Opn cortex lacer-no coma,"Cortex (cerebral) laceration with open intracranial wound, with no loss of consciousness"
88001,Open wound of scapula,"Open wound of scapular region, without mention of complication"
80432,Cl skl w oth fx-brf coma,"Closed fractures involving skull or face with other bones, with other and unspecified intracranial hemorrhage, with brief [less than one hour] loss of consciousness"
81101,"Fx scapul, acrom proc-cl",Closed fracture of acromial process of scapula
9515,Injury to acoustic nerve,Injury to acoustic nerve
64264,Eclampsia-postpartum,"Eclampsia, postpartum condition or complication"
64814,Thyroid dysfunc-postpart,"Thyroid dysfunction of mother, postpartum condition or complication"
V604,No family able to care,No other household member able to render care
V074,Hormone replace postmeno,Hormone replacement therapy (postmenopausal)
71216,Dicalc phos cryst-l/leg,"Chondrocalcinosis, due to dicalcium phosphate crystals, lower leg"
04105,Streptococcus group g,"Streptococcus infection in conditions classified elsewhere and of unspecified site, streptococcus, group G"
86809,Intra-abdom inj NEC-clos,Injury to other and multiple intra-abdominal organs without mention of open wound into cavity
6080,Seminal vesiculitis,Seminal vesiculitis
E8841,Fall from cliff,Accidental fall from cliff
1431,Malig neo lower gum,Malignant neoplasm of lower gum
9220,Contusion of breast,Contusion of breast
80180,Opn skul base fx/hem NEC,"Open fracture of base of skull with other and unspecified intracranial hemorrhage, unspecified state of consciousness"
78951,Malignant ascites,Malignant ascites
27950,Graft-versus-host NOS,"Graft-versus-host disease, unspecified"
7030,Ingrowing nail,Ingrowing nail
87261,Open wound of ear drum,"Open wound of ear drum, without mention of complication"
83661,Ant disl prox tibia-open,"Anterior dislocation of tibia, proximal end, open"
72789,Synov/tend/bursa dis NEC,"Other disorders of synovium, tendon, and bursa"
7010,Circumscribe scleroderma,Circumscribed scleroderma
0700,Hepatitis A with coma,Viral hepatitis A with hepatic coma
31239,Impulse control dis NEC,Other disorders of impulse control
7901,Elevated sediment rate,Elevated sedimentation rate
75511,Syndactyl fing-no fusion,Syndactyly of fingers without fusion of bone
E9193,Metalworking machine acc,Accidents caused by metalworking machines
36101,Part detach-singl defec,"Recent retinal detachment, partial, with single defect"
0940,Tabes dorsalis,Tabes dorsalis
2302,Ca in situ stomach,Carcinoma in situ of stomach
01193,Pulmon TB NOS-micro dx,"Pulmonary tuberculosis, unspecified, tubercle bacilli found (in sputum) by microscopy"
38610,Peripheral vertigo NOS,"Peripheral vertigo, unspecified"
85175,Opn cerebe lac-deep coma,"Cerebellar or brain stem laceration with open intracranial wound, with prolonged [more than 24 hours] loss of consciousness without return to pre-existing conscious level"
9249,Contusion NOS,Contusion of unspecified site
E8250,Mv n-traff acc NEC-driv,Other motor vehicle nontraffic accident of other and unspecified nature injuring driver of motor vehicle other than motorcycle
9068,Late effect of burns NEC,Late effect of burns of other specified sites
0790,Adenovirus infect NOS,Adenovirus infection in conditions classified elsewhere and of unspecified site
4350,Basilar artery syndrome,Basilar artery syndrome
6184,Utervaginal prolapse NOS,"Uterovaginal prolapse, unspecified"
V7281,Preop cardiovsclr exam,Pre-operative cardiovascular examination
1905,Malign neopl retina,Malignant neoplasm of retina
V1261,Prsnl hx recur pneumonia,Personal history of pneumonia (recurrent)
53230,Acute duodenal ulcer NOS,"Acute duodenal ulcer without mention of hemorrhage or perforation, without mention of obstruction"
30009,Anxiety state NEC,Other anxiety states
6214,Hematometra,Hematometra
38872,Referred pain of ear,Referred otogenic pain
E8850,Fall-nonmotor scooter,Fall from (nonmotorized) scooter
77430,Delay conjugat jaund NOS,"Neonatal jaundice due to delayed conjugation, cause unspecified"
6938,Dermat d/t int agent NEC,Dermatitis due to other specified substances taken internally
7402,Iniencephaly,Iniencephaly
2891,Chronic lymphadenitis,Chronic lymphadenitis
85231,Open subdur hem w/o coma,"Subdural hemorrhage following injury with open intracranial wound, with no loss of consciousness"
37431,Paralytic ptosis,Paralytic ptosis
E9678,Batter by non-relative,"Perpetrator of child and adult abuse, by non-related caregiver"
99581,Adult physical abuse,Adult physical abuse
V331,Twin NOS-before admissn,"Twin birth, unspecified whether mate liveborn or stillborn, born before admission to hospital"
33189,Cereb degeneration NEC,Other cerebral degeneration
0520,Postvaricella encephalit,Postvaricella encephalitis
74600,Pulmonary valve anom NOS,"Congenital pulmonary valve anomaly, unspecified"
0902,Early congen syph NOS,"Early congenital syphilis, unspecified"
75520,Reduc deform up limb NOS,Unspecified reduction deformity of upper limb
42518,Oth hyprtrophic cardiomy,Other hypertrophic cardiomyopathy
9605,Pois-cephalosporin group,Poisoning of cephalosporin group
5088,Resp cond: ext agent NEC,Respiratory conditions due to other specified external agents
6012,Abscess of prostate,Abscess of prostate
6278,Menopausal disorder NEC,Other specified menopausal and postmenopausal disorders
4473,Renal artery hyperplasia,Hyperplasia of renal artery
37749,Optic nerve disorder NEC,Other disorders of optic nerve
9664,Pois-anti-parkinson drug,Poisoning by anti-Parkinsonism drugs
9513,Injury abducens nerve,Injury to abducens nerve
9510,Injury oculomotor nerve,Injury to oculomotor nerve
81302,Fx coronoid proc ulna-cl,Closed fracture of coronoid process of ulna
74912,Unilat cleft lip-imcompl,"Cleft lip, unilateral, incomplete"
V289,Antenatal screening NOS,Unspecified antenatal screening
8961,"Amput foot, unilat-compl","Traumatic amputation of foot (complete) (partial), unilateral, complicated"
E9200,Acc-powered lawn mower,Accidents caused by powered lawn mower
5273,Salivary gland abscess,Abscess of salivary gland
1449,Mal neo mouth floor NOS,"Malignant neoplasm of floor of mouth, part unspecified"
V1250,Hx-circulatory dis NOS,Personal history of unspecified circulatory disease
9802,Toxic eff isopropyl alc,Toxic effect of isopropyl alcohol
E8603,Acc poisn-isopropyl alc,Accidental poisoning by isopropyl alcohol
31289,Other conduct disorder,Other conduct disorder
E8182,Mv traff acc NEC-mocycl,Other noncollision motor vehicle traffic accident injuring motorcyclist
E9457,Adv eff antiasthmatics,Antiasthmatics causing adverse effects in therapeutic use
73320,Cyst of bone NOS,"Cyst of bone (localized), unspecified"
7937,Nonsp abn find-ms system,Nonspecific (abnormal) findings on radiological and other examination of musculoskeletal system
80336,Cl skull fx NEC-coma NOS,"Other closed skull fracture with other and unspecified intracranial hemorrhage, with loss of consciousness of unspecified duration"
E9387,Adv eff spinal anesthet,Spinal anesthetics causing adverse effects in therapeutic use
52406,Microgenia,"Major anomalies of jaw size, microgenia"
28733,Cong/herid thromb purpra,Congenital and hereditary thrombocytopenic purpura
20891,Leukemia NOS w remission,"Unspecified leukemia, in remission"
20490,Uns lym leu wo ach rmsn,"Unspecified lymphoid leukemia, without mention of having achieved remission"
6150,Ac uterine inflammation,"Acute inflammatory diseases of uterus, except cervix"
9948,Effects electric current,Electrocution and nonfatal effects of electric current
59370,Vescouretrl rflux unspcf,Vesicoureteral reflux unspecified or without reflux nephropathy
7744,Fetal/neonatal hepatitis,Perinatal jaundice due to hepatocellular damage
07059,Oth vrl hpat wo hpt coma,Other specified viral hepatitis without mention of hepatic coma
30480,Comb drug dep NEC-unspec,"Combinations of drug dependence excluding opioid type drug, unspecified"
29282,Drug persisting dementia,Drug-induced persisting dementia
5940,Blad diverticulum calcul,Calculus in diverticulum of bladder
9851,Toxic effect arsenic,Toxic effect of arsenic and its compounds
E8663,Acc poisoning-arsenic,Accidental poisoning by arsenic and its compounds and fumes
1535,Malignant neo appendix,Malignant neoplasm of appendix vermiformis
V110,Hx of schizophrenia,Personal history of schizophrenia
7222,Disc displacement NOS,"Displacement of intervertebral disc, site unspecified, without myelopathy"
7916,Acetonuria,Acetonuria
59011,Ac pyelonephr w med necr,Acute pyelonephritis with lesion of renal medullary necrosis
75317,Medullary sponge kidney,Medullary sponge kidney
27953,Ac on chrn grft-vs-host,Acute on chronic graft-versus-host disease
E8582,Acc poison-blood agent,Accidental poisoning by agents primarily affecting blood constituents
E9000,Excessive heat: weather,Accident caused by excessive heat due to weather conditions
36901,Tot impairment-both eyes,Better eye: total vision impairment; lesser eye: total vision impairment
