icd9_code,short_title,long_title
E8790,Abn react-cardiac cath,"Cardiac catheterization as the cause of abnormal reaction of patient, or of later complication, without mention of misadventure at time of procedure"
42789,Cardiac dysrhythmias NEC,Other specified cardiac dysrhythmias
42822,Chr systolic hrt failure,Chronic systolic heart failure
4263,Left bb block NEC,Other left bundle branch block
41401,Crnry athrscl natve vssl,Coronary atherosclerosis of native coronary artery
V5861,Long-term use anticoagul,Long-term (current) use of anticoagulants
4280,CHF NOS,"Congestive heart failure, unspecified"
2449,Hypothyroidism NOS,Unspecified acquired hypothyroidism
3659,Glaucoma NOS,Unspecified glaucoma
3962,Mitral insuf/aort stenos,Mitral valve insufficiency and aortic valve stenosis
4260,Atriovent block complete,"Atrioventricular block, complete"
2875,Thrombocytopenia NOS,"Thrombocytopenia, unspecified"
9971,Surg compl-heart,"Cardiac complications, not elsewhere classified"
42731,Atrial fibrillation,Atrial fibrillation
42732,Atrial flutter,Atrial flutter
4019,Hypertension NOS,Unspecified essential hypertension
25000,DMII wo cmp nt st uncntr,"Diabetes mellitus without mention of complication, type II or unspecified type, not stated as uncontrolled"
71590,Osteoarthros NOS-unspec,"Osteoarthrosis, unspecified whether generalized or localized, site unspecified"
99831,Disrup internal op wound,Disruption of internal operation (surgical) wound
99811,Hemorrhage complic proc,Hemorrhage complicating a procedure
41511,Iatrogen pulm emb/infarc,Iatrogenic pulmonary embolism and infarction
99672,Comp-oth cardiac device,"Other complications due to other cardiac device, implant, and graft"
496,Chr airway obstruct NEC,"Chronic airway obstruction, not elsewhere classified"
V4581,Aortocoronary bypass,Aortocoronary bypass status
60000,BPH w/o urinary obs/LUTS,Hypertrophy (benign) of prostate without urinary obstruction and other lower urinary tract symptom (LUTS)
53081,Esophageal reflux,Esophageal reflux
V1051,Hx of bladder malignancy,Personal history of malignant neoplasm of bladder
55321,Incisional hernia,Incisional hernia without mention of obstruction or gangrene
486,"Pneumonia, organism NOS","Pneumonia, organism unspecified"
99739,Respiratory comp NEC,Other respiratory complications
5180,Pulmonary collapse,Pulmonary collapse
41400,Cor ath unsp vsl ntv/gft,"Coronary atherosclerosis of unspecified type of vessel, native or graft"
30000,Anxiety state NOS,"Anxiety state, unspecified"
4111,Intermed coronary synd,Intermediate coronary syndrome
3051,Tobacco use disorder,Tobacco use disorder
41071,"Subendo infarct, initial","Subendocardial infarction, initial episode of care"
53551,Gstr/ddnts NOS w hmrhg,"Unspecified gastritis and gastroduodenitis, with hemorrhage"
2851,Ac posthemorrhag anemia,Acute posthemorrhagic anemia
60883,Male gen vascul dis NEC,Vascular disorders of male genital organs
0389,Septicemia NOS,Unspecified septicemia
99592,Severe sepsis,Severe sepsis
5849,Acute kidney failure NOS,"Acute kidney failure, unspecified"
9982,Accidental op laceration,"Accidental puncture or laceration during a procedure, not elsewhere classified"
5601,Paralytic ileus,Paralytic ileus
6084,Male gen inflam dis NEC,Other inflammatory disorders of male genital organs
E8708,Acc cut in med care NEC,"Accidental cut, puncture, perforation or hemorrhage during other specified medical care"
V3000,Single lb in-hosp w/o cs,"Single liveborn, born in hospital, delivered without mention of cesarean section"
769,Respiratory distress syn,Respiratory distress syndrome in newborn
7742,Neonat jaund preterm del,Neonatal jaundice associated with preterm delivery
76519,Preterm NEC 2500+g,"Other preterm infants, 2,500 grams and over"
V290,NB obsrv suspct infect,Observation for suspected infectious condition
V058,Vaccin for disease NEC,Need for prophylactic vaccination and inoculation against other specified disease
V053,Need prphyl vc vrl hepat,Need for prophylactic vaccination and inoculation against viral hepatitis
1917,Mal neo brain stem,Malignant neoplasm of brain stem
5130,Abscess of lung,Abscess of lung
48241,Meth sus pneum d/t Staph,Methicillin susceptible pneumonia due to Staphylococcus aureus
5070,Food/vomit pneumonitis,Pneumonitis due to inhalation of food or vomitus
70705,"Pressure ulcer, buttock","Pressure ulcer, buttock"
1124,Candidiasis of lung,Candidiasis of lung
48282,Pneumonia e coli,Pneumonia due to escherichia coli [E. coli]
78820,Retention urine NOS,"Retention of urine, unspecified"
5121,Iatrogenic pneumothorax,Iatrogenic pneumothorax
70703,"Pressure ulcer, low back","Pressure ulcer, lower back"
3485,Cerebral edema,Cerebral edema
V1005,Hx of colonic malignancy,Personal history of malignant neoplasm of large intestine
V1047,Hx-testicular malignancy,Personal history of malignant neoplasm of testis
2859,Anemia NOS,"Anemia, unspecified"
7099,Skin disorder NOS,Unspecified disorder of skin and subcutaneous tissue
42741,Ventricular fibrillation,Ventricular fibrillation
412,Old myocardial infarct,Old myocardial infarction
43820,Late ef-hemplga side NOS,"Late effects of cerebrovascular disease, hemiplegia affecting unspecified side"
43819,Late ef-spch/lang df NEC,"Late effects of cerebrovascular disease, other speech and language deficits"
8052,Fx dorsal vertebra-close,Closed fracture of dorsal [thoracic] vertebra without mention of spinal cord injury
E8210,Oth off-road mv acc-driv,Nontraffic accident involving other off-road motor vehicle injuring driver of motor vehicle other than motorcycle
4139,Angina pectoris NEC/NOS,Other and unspecified angina pectoris
5960,Bladder neck obstruction,Bladder neck obstruction
3968,Mitr/aortic mult involv,Multiple involvement of mitral and aortic valves
2720,Pure hypercholesterolem,Pure hypercholesterolemia
78057,Sleep apnea NOS,Unspecified sleep apnea
V173,Fam hx-ischem heart dis,Family history of ischemic heart disease
4439,Periph vascular dis NOS,"Peripheral vascular disease, unspecified"
8249,Fx ankle NOS-open,"Unspecified fracture of ankle, open"
9984,FB left during procedure,Foreign body accidentally left during a procedure
8730,Open wound of scalp,"Open wound of scalp, without mention of complication"
87344,Open wound of jaw,"Open wound of jaw, without mention of complication"
9110,Abrasion trunk,"Abrasion or friction burn of trunk, without mention of infection"
9130,Abrasion forearm,"Abrasion or friction burn of elbow, forearm, and wrist, without mention of infection"
E8122,Mv collis NOS-motorcycl,Other motor vehicle traffic accident involving collision with motor vehicle injuring motorcyclist
5768,Dis of biliary tract NEC,Other specified disorders of biliary tract
20300,Mult mye w/o achv rmson,"Multiple myeloma, without mention of having achieved remission"
99659,Malfunc oth device/graft,"Mechanical complication due to other implant and internal device, not elsewhere classified"
2809,Iron defic anemia NOS,"Iron deficiency anemia, unspecified"
2811,B12 defic anemia NEC,Other vitamin B12 deficiency anemia
22809,Hemangioma NEC,Hemangioma of other sites
4241,Aortic valve disorder,Aortic valve disorders
2939,Transient mental dis NOS,Unspecified transient mental disorder in conditions classified elsewhere
40390,Hy kid NOS w cr kid I-IV,"Hypertensive chronic kidney disease, unspecified, with chronic kidney disease stage I through stage IV, or unspecified"
56409,Constipation NEC,Other constipation
311,Depressive disorder NEC,"Depressive disorder, not elsewhere classified"
V4582,Status-post ptca,Percutaneous transluminal coronary angioplasty status
2724,Hyperlipidemia NEC/NOS,Other and unspecified hyperlipidemia
7746,Fetal/neonatal jaund NOS,Unspecified fetal and neonatal jaundice
7661,Heavy-for-date infan NEC,"Other ""heavy-for-dates"" infants"
V293,NB obs genetc/metabl cnd,Observation for suspected genetic or metabolic condition
V502,Routine circumcision,Routine or ritual circumcision
7907,Bacteremia,Bacteremia
78039,Convulsions NEC,Other convulsions
58089,Acute nephritis NEC,Acute glomerulonephritis with other specified pathological lesion in kidney
5712,Alcohol cirrhosis liver,Alcoholic cirrhosis of liver
07054,Chrnc hpt C wo hpat coma,Chronic hepatitis C without mention of hepatic coma
04111,Mth sus Stph aur els/NOS,Methicillin susceptible Staphylococcus aureus in conditions classified elsewhere and of unspecified site
5728,"Oth sequela, chr liv dis",Other sequelae of chronic liver disease
41021,"AMI inferolateral, init","Acute myocardial infarction of inferolateral wall, initial episode of care"
30562,Cocaine abuse-episodic,"Cocaine abuse, episodic"
V3001,Single lb in-hosp w cs,"Single liveborn, born in hospital, delivered by cesarean section"
43310,Ocl crtd art wo infrct,Occlusion and stenosis of carotid artery without mention of cerebral infarction
V1011,Hx-bronchogenic malignan,Personal history of malignant neoplasm of bronchus and lung
V4502,Status autm crd dfbrltr,Automatic implantable cardiac defibrillator in situ
1983,Sec mal neo brain/spine,Secondary malignant neoplasm of brain and spinal cord
1628,Mal neo bronch/lung NEC,Malignant neoplasm of other parts of bronchus or lung
53140,Chr stomach ulc w hem,"Chronic or unspecified gastric ulcer with hemorrhage, without mention of obstruction"
2761,Hyposmolality,Hyposmolality and/or hyponatremia
2161,Benign neo skin eyelid,"Benign neoplasm of eyelid, including canthus"
5990,Urin tract infection NOS,"Urinary tract infection, site not specified"
40391,Hyp kid NOS w cr kid V,"Hypertensive chronic kidney disease, unspecified, with chronic kidney disease stage V or end stage renal disease"
5856,End stage renal disease,End stage renal disease
25080,DMII oth nt st uncntrld,"Diabetes with other specified manifestations, type II or unspecified type, not stated as uncontrolled"
4589,Hypotension NOS,"Hypotension, unspecified"
2948,Mental disor NEC oth dis,Other persistent mental disorders due to conditions classified elsewhere
78701,Nausea with vomiting,Nausea with vomiting
V4501,Status cardiac pacemaker,Cardiac pacemaker in situ
28529,Anemia-other chronic dis,Anemia of other chronic disease
V3401,Oth mult lb-in hosp w cs,"Other multiple birth (three or more), mates all liveborn, born in hospital, delivered by cesarean section"
76518,Preterm NEC 2000-2499g,"Other preterm infants, 2,000-2,499 grams"
76527,33-34 comp wks gestation,33-34 completed weeks of gestation
20280,Oth lymp unsp xtrndl org,"Other malignant lymphomas, unspecified site, extranodal and solid organ sites"
5781,Blood in stool,Blood in stool
2639,Protein-cal malnutr NOS,Unspecified protein-calorie malnutrition
5790,Celiac disease,Celiac disease
6930,Drug dermatitis NOS,Dermatitis due to drugs and medicines taken internally
99685,Compl marrow transplant,Complications of transplanted bone marrow
56983,Perforation of intestine,Perforation of intestine
2762,Acidosis,Acidosis
99591,Sepsis,Sepsis
2763,Alkalosis,Alkalosis
7994,Cachexia,Cachexia
1120,Thrush,Candidiasis of mouth
3510,Bell's palsy,Bell's palsy
0880,Bartonellosis,Bartonellosis
1125,Disseminated candidiasis,Disseminated candidiasis
03849,Gram-neg septicemia NEC,Other septicemia due to gram-negative organisms
7100,Syst lupus erythematosus,Systemic lupus erythematosus
7140,Rheumatoid arthritis,Rheumatoid arthritis
71945,Joint pain-pelvis,"Pain in joint, pelvic region and thigh"
57420,Cholelithiasis NOS,"Calculus of gallbladder without mention of cholecystitis, without mention of obstruction"
4148,Chr ischemic hrt dis NEC,Other specified forms of chronic ischemic heart disease
E8889,Fall NOS,Unspecified fall
E8498,Accident in place NEC,Accidents occurring in other specified places
7808,Generalizd hyperhidrosis,Generalized hyperhidrosis
3079,Special symptom NEC/NOS,"Other and unspecified special symptoms or syndromes, not elsewhere classified"
4210,Ac/subac bact endocard,Acute and subacute bacterial endocarditis
V4511,Renal dialysis status,Renal dialysis status
34590,Epilep NOS w/o intr epil,"Epilepsy, unspecified, without mention of intractable epilepsy"
56400,Constipation NOS,"Constipation, unspecified"
28521,Anemia in chr kidney dis,Anemia in chronic kidney disease
79092,Abnrml coagultion prfile,Abnormal coagulation profile
32723,Obstructive sleep apnea,Obstructive sleep apnea (adult)(pediatric)
51889,Other lung disease NEC,"Other diseases of lung, not elsewhere classified"
78659,Chest pain NEC,Other chest pain
78060,Fever NOS,"Fever, unspecified"
7821,Nonspecif skin erupt NEC,Rash and other nonspecific skin eruption
4168,Chr pulmon heart dis NEC,Other chronic pulmonary heart diseases
V1251,Hx-ven thrombosis/embols,Personal history of venous thrombosis and embolism
4372,Hypertens encephalopathy,Hypertensive encephalopathy
40301,Mal hyp kid w cr kid V,"Hypertensive chronic kidney disease, malignant, with chronic kidney disease stage V or end stage renal disease"
58281,Chr nephritis in oth dis,Chronic glomerulonephritis in diseases classified elsewhere
4254,Prim cardiomyopathy NEC,Other primary cardiomyopathies
78702,Nausea alone,Nausea alone
E9426,Adv eff antihyperten agt,Other antihypertensive agents causing adverse effects in therapeutic use
9596,Hip & thigh injury NOS,Hip and thigh injury
E9289,Accident NOS,Unspecified accident
2767,Hyperpotassemia,Hyperpotassemia
2753,Dis phosphorus metabol,Disorders of phosphorus metabolism
27541,Hypocalcemia,Hypocalcemia
58881,Sec hyperparathyrd-renal,Secondary hyperparathyroidism (of renal origin)
3643,Iridocyclitis NOS,Unspecified iridocyclitis
78959,Ascites NEC,Other ascites
33829,Chronic pain NEC,Other chronic pain
78900,Abdmnal pain unspcf site,"Abdominal pain, unspecified site"
44389,Periph vascular dis NEC,Other specified peripheral vascular diseases
53190,Stomach ulcer NOS,"Gastric ulcer, unspecified as acute or chronic, without mention of hemorrhage or perforation, without mention of obstruction"
V1254,Hx TIA/stroke w/o resid,"Personal history of transient ischemic attack (TIA), and cerebral infarction without residual deficits"
79902,Hypoxemia,Hypoxemia
E9352,Adv eff opiates,Other opiates and related narcotics causing adverse effects in therapeutic use
78909,Abdmnal pain oth spcf st,"Abdominal pain, other specified site"
3004,Dysthymic disorder,Dysthymic disorder
V4589,Post-proc states NEC,Other postprocedural status
4239,Pericardial disease NOS,Unspecified disease of pericardium
V4512,Noncmplnt w renal dialys,Noncompliance with renal dialysis
58381,Nephritis NOS in oth dis,"Nephritis and nephropathy, not specified as acute or chronic, in diseases classified elsewhere"
V1581,Hx of past noncompliance,"Personal history of noncompliance with medical treatment, presenting hazards to health"
V642,No proc/patient decision,Surgical or other procedure not carried out because of patient's decision
78904,Abdmnal pain lt lwr quad,"Abdominal pain, left lower quadrant"
V4578,Acquired absence of eye,"Acquired absence of organ, eye"
V0254,Meth resis Staph carrier,Carrier or suspected carrier of Methicillin resistant Staphylococcus aureus
5855,Chron kidney dis stage V,"Chronic kidney disease, Stage V"
7243,Sciatica,Sciatica
25200,Hyperparathyroidism NOS,"Hyperparathyroidism, unspecified"
99656,Comp-periton dialys cath,Mechanical complication due to peritoneal dialysis catheter
9951,Angioneurotic edema,"Angioneurotic edema, not elsewhere classified"
V5865,Long-term use steroids,Long-term (current) use of steroids
E8781,Abn react-artif implant,"Surgical operation with implant of artificial internal device causing abnormal patient reaction, or later complication,without mention of misadventure at time of operation"
34839,Encephalopathy NEC,Other encephalopathy
2839,Acq hemolytic anemia NOS,"Acquired hemolytic anemia, unspecified"
7842,Swelling in head & neck,"Swelling, mass, or lump in head and neck"
61172,Lump or mass in breast,Lump or mass in breast
78791,Diarrhea,Diarrhea
4592,Compression of vein,Compression of vein
33819,Acute pain NEC,Other acute pain
73399,Bone & cartilage dis NEC,Other disorders of bone and cartilage
62211,Mild dysplasia of cervix,Mild dysplasia of cervix
99662,React-oth vasc dev/graft,"Infection and inflammatory reaction due to other vascular device, implant, and graft"
28981,Prim hypercoagulable st,Primary hypercoagulable state
04104,Enterococcus group d,"Streptococcus infection in conditions classified elsewhere and of unspecified site, streptococcus, group D [Enterococcus]"
E8791,Abn react-renal dialysis,"Kidney dialysis as the cause of abnormal reaction of patient, or of later complication, without mention of misadventure at time of procedure"
04112,MRSA elsewhere/NOS,Methicillin resistant Staphylococcus aureus in conditions classified elsewhere and of unspecified site
96509,Poisoning-opiates NEC,Poisoning by other opiates and related narcotics
4466,Thrombot microangiopathy,Thrombotic microangiopathy
78097,Altered mental status,Altered mental status
45829,Iatrogenc hypotnsion NEC,Other iatrogenic hypotension
E8502,Acc poison-opiates NEC,Accidental poisoning by other opiates and related narcotics
72992,Nontrauma hema soft tiss,Nontraumatic hematoma of soft tissue
7840,Headache,Headache
V4983,Await organ transplnt st,Awaiting organ transplant status
4010,Malignant hypertension,Malignant essential hypertension
V4569,Post-proc st eye/adn NEC,Other states following surgery of eye and adnexa
79500,Abn glandular pap smear,Abnormal glandular Papanicolaou smear of cervix
2518,Pancreatic disorder NEC,Other specified disorders of pancreatic internal secretion
E9320,Adv eff corticosteroids,Adrenal cortical steroids causing adverse effects in therapeutic use
5589,Noninf gastroenterit NEC,Other and unspecified noninfectious gastroenteritis and colitis
22804,Hemangioma intra-abdom,Hemangioma of intra-abdominal structures
53100,Ac stomach ulcer w hem,"Acute gastric ulcer with hemorrhage, without mention of obstruction"
725,Polymyalgia rheumatica,Polymyalgia rheumatica
1915,Mal neo cereb ventricle,Malignant neoplasm of ventricles
3314,Obstructiv hydrocephalus,Obstructive hydrocephalus
48283,Pneumo oth grm-neg bact,Pneumonia due to other gram-negative bacteria
1940,Malign neopl adrenal,Malignant neoplasm of adrenal gland
1977,Second malig neo liver,"Malignant neoplasm of liver, secondary"
2553,Corticoadren overact NEC,Other corticoadrenal overactivity
4240,Mitral valve disorder,Mitral valve disorders
5845,"Ac kidny fail, tubr necr",Acute kidney failure with lesion of tubular necrosis
99859,Other postop infection,Other postoperative infection
6822,Cellulitis of trunk,Cellulitis and abscess of trunk
5119,Pleural effusion NOS,Unspecified pleural effusion
34982,Toxic encephalopathy,Toxic encephalopathy
V1000,Hx of GI malignancy NOS,"Personal history of malignant neoplasm of gastrointestinal tract, unspecified"
V453,Intestinal bypass status,Intestinal bypass or anastomosis status
0413,Klebsiella pneumoniae,Friedl?nder's bacillus infection in conditions classified elsewhere and of unspecified site
5715,Cirrhosis of liver NOS,Cirrhosis of liver without mention of alcohol
570,Acute necrosis of liver,Acute and subacute necrosis of liver
07044,Chrnc hpt C w hepat Coma,Chronic hepatitis C with hepatic coma
5724,Hepatorenal syndrome,Hepatorenal syndrome
2867,Acq coagul factor defic,Acquired coagulation factor deficiency
51882,Other pulmonary insuff,"Other pulmonary insufficiency, not elsewhere classified"
2800,Chr blood loss anemia,Iron deficiency anemia secondary to blood loss (chronic)
30393,Alcoh dep NEC/NOS-remiss,"Other and unspecified alcohol dependence, in remission"
5723,Portal hypertension,Portal hypertension
1122,Candidias urogenital NEC,Candidiasis of other urogenital sites
88122,Opn wound wrist w tendon,"Open wound of wrist, with tendon involvement"
9032,Injury radial vessels,Injury to radial blood vessels
9033,Injury ulnar vessels,Injury to ulnar blood vessels
9551,Injury median nerve,Injury to median nerve
9555,Inj cutan senso nerv/arm,"Injury to cutaneous sensory nerve, upper limb"
9552,Injury ulnar nerve,Injury to ulnar nerve
E956,Injury-cut instrument,Suicide and self-inflicted injury by cutting and piercing instrument
30590,Drug abuse NEC-unspec,"Other, mixed, or unspecified drug abuse, unspecified"
7452,Tetralogy of fallot,Tetralogy of fallot
7622,Abn plac NEC/NOS aff NB,Other and unspecified morphological and functional abnormalities of placenta affecting fetus or newborn
41011,"AMI anterior wall, init","Acute myocardial infarction of other anterior wall, initial episode of care"
4412,Thoracic aortic aneurysm,Thoracic aneurysm without mention of rupture
07070,Hpt C w/o hepat coma NOS,Unspecified viral hepatitis C without hepatic coma
4478,Arterial disease NEC,Other specified disorders of arteries and arterioles
41402,Crn ath atlg vn bps grft,Coronary atherosclerosis of autologous vein bypass graft
44021,Ath ext ntv at w claudct,Atherosclerosis of native arteries of the extremities with intermittent claudication
5854,Chr kidney dis stage IV,"Chronic kidney disease, Stage IV (severe)"
4400,Aortic atherosclerosis,Atherosclerosis of aorta
2749,Gout NOS,"Gout, unspecified"
V1046,Hx-prostatic malignancy,Personal history of malignant neoplasm of prostate
V1209,Prsnl hst oth nfct parst,Personal history of other infectious and parasitic diseases
V090,Inf mcrg rstn pncllins,Infection with microorganisms resistant to penicillins
56089,Intestinal obstruct NEC,Other specified intestinal obstruction
49121,Obs chr bronc w(ac) exac,Obstructive chronic bronchitis with (acute) exacerbation
42833,Ac on chr diast hrt fail,Acute on chronic diastolic heart failure
43331,Ocl mlt bi art w infrct,Occlusion and stenosis of multiple and bilateral precerebral arteries with cerebral infarction
99812,Hematoma complic proc,Hematoma complicating a procedure
436,Cva,"Acute, but ill-defined, cerebrovascular disease"
43320,Ocl vrtb art wo infrct,Occlusion and stenosis of vertebral artery without mention of cerebral infarction
49390,Asthma NOS,"Asthma, unspecified type, unspecified"
99671,Comp-heart valve prosth,Other complications due to heart valve prosthesis
V3101,Twin-mate lb-in hos w cs,"Twin birth, mate liveborn, born in hospital, delivered by cesarean section"
76503,Extreme immatur 750-999g,"Extreme immaturity, 750-999 grams"
7707,Perinatal chr resp dis,Chronic respiratory disease arising in the perinatal period
76524,27-28 comp wks gestation,27-28 completed weeks of gestation
77081,Primary apnea of newborn,Primary apnea of newborn
77981,Neonatal bradycardia,Neonatal bradycardia
7470,Patent ductus arteriosus,Patent ductus arteriosus
7766,Anemia of prematurity,Anemia of prematurity
7726,NB cutaneous hemorrhage,Cutaneous hemorrhage of fetus or newborn
77989,Perinatal condition NEC,Other specified conditions originating in the perinatal period
36221,Retrolental fibroplasia,Retrolental fibroplasia
19889,Secondary malig neo NEC,Secondary malignant neoplasm of other specified sites
1972,Second malig neo pleura,Secondary malignant neoplasm of pleura
V103,Hx of breast malignancy,Personal history of malignant neoplasm of breast
74689,Cong heart anomaly NEC,Other specified congenital anomalies of heart
85300,Traumatic brain hem NEC,"Other and unspecified intracranial hemorrhage following injury without mention of open intracranial wound, unspecified state of consciousness"
73028,Osteomyelit NOS-oth site,"Unspecified osteomyelitis, other specified sites"
25060,DMII neuro nt st uncntrl,"Diabetes with neurological manifestations, type II or unspecified type, not stated as uncontrolled"
3572,Neuropathy in diabetes,Polyneuropathy in diabetes
77214,"NB intraven hem,grade iv","Intraventricular hemorrhage, grade IV"
76528,35-36 comp wks gestation,35-36 completed weeks of gestation
430,Subarachnoid hemorrhage,Subarachnoid hemorrhage
V1582,History of tobacco use,Personal history of tobacco use
3963,Mitral/aortic val insuff,Mitral valve insufficiency and aortic valve insufficiency
135,Sarcoidosis,Sarcoidosis
72141,Spond compr thor sp cord,"Spondylosis with myelopathy, thoracic region"
2148,Lipoma NEC,Lipoma of other specified sites
72401,Spinal stenosis-thoracic,"Spinal stenosis, thoracic region"
4375,Moyamoya disease,Moyamoya disease
24290,Thyrotox NOS no crisis,"Thyrotoxicosis without mention of goiter or other cause, and without mention of thyrotoxic crisis or storm"
1890,Malig neopl kidney,"Malignant neoplasm of kidney, except pelvis"
03811,Meth susc Staph aur sept,Methicillin susceptible Staphylococcus aureus septicemia
30400,Opioid dependence-unspec,"Opioid type dependence, unspecified"
5111,Bact pleur/effus not TB,"Pleurisy with effusion, with mention of a bacterial cause other than tuberculosis"
71107,Pyogen arthritis-ankle,"Pyogenic arthritis, ankle and foot"
71104,Pyogen arthritis-hand,"Pyogenic arthritis, hand"
80012,Cl skull vlt fx-brf coma,"Closed fracture of vault of skull with cerebral laceration and contusion, with brief [less than one hour] loss of consciousness"
30500,Alcohol abuse-unspec,"Alcohol abuse, unspecified"
30560,Cocaine abuse-unspec,"Cocaine abuse, unspecified"
E8147,Mv coll w pedest-pedest,Motor vehicle traffic accident involving collision with pedestrian injuring pedestrian
7812,Abnormality of gait,Abnormality of gait
37854,Sixth nerve palsy,Sixth or abducens nerve palsy
9518,Injury cranial nerve NEC,Injury to other specified cranial nerves
77089,Resp prob after brth NEC,Other respiratory problems after birth
7678,Birth trauma NEC,Other specified birth trauma
431,Intracerebral hemorrhage,Intracerebral hemorrhage
2768,Hypopotassemia,Hypopotassemia
042,Human immuno virus dis,Human immunodeficiency virus [HIV] disease
5859,Chronic kidney dis NOS,"Chronic kidney disease, unspecified"
42820,Systolic hrt failure NOS,"Systolic heart failure, unspecified"
V141,Hx-antibiot allergy NEC,Personal history of allergy to other antibiotic agent
V071,Desensitiza to allergens,Need for desensitization to allergens
76517,Preterm NEC 1750-1999g,"Other preterm infants, 1,750-1,999 grams"
