icd9_code,short_title,long_title
80125,Cl skl base fx-deep coma,"Closed fracture of base of skull with subarachnoid, subdural, and extradural hemorrhage, with prolonged [more than 24 hours] loss of consciousness, without return to pre-existing conscious level"
80224,Fx ramus NOS-closed,"Closed fracture of mandible, ramus, unspecified"
75733,Cong skin pigment anomal,Congenital pigmentary anomalies of skin
5272,Sialoadenitis,Sialoadenitis
30981,Posttraumatic stress dis,Posttraumatic stress disorder
99701,Surg complication - cns,Central nervous system complication
80100,Clos skull base fracture,"Closed fracture of base of skull without mention of intra cranial injury, unspecified state of consciousness"
81342,Fx distal radius NEC-cl,Other closed fractures of distal end of radius (alone)
80220,Mandible fx NOS-closed,"Closed fracture of mandible, unspecified site"
81502,Fx metacarp base NEC-cl,Closed fracture of base of other metacarpal bone(s)
V163,Family hx-breast malig,Family history of malignant neoplasm of breast
V1279,Prsnl hst ot spf dgst ds,Personal history of other diseases of digestive system
40291,Hyp ht dis NOS w ht fail,Unspecified hypertensive heart disease with heart failure
42979,Other sequelae of MI NEC,"Certain sequelae of myocardial infarction, not elsewhere classified, other"
2900,Senile dementia uncomp,"Senile dementia, uncomplicated"
V1588,Personal history of fall,History of fall
80301,Cl skull fx NEC w/o coma,"Other closed skull fracture without mention of intracranial injury, with no loss of consciousness"
8690,Internal inj NOS-closed,Internal injury to unspecified or ill-defined organs without mention of open wound into cavity
87320,Open wound of nose NOS,"Open wound of nose, unspecified site, without mention of complication"
8241,Fx medial malleolus-open,"Fracture of medial malleolus, open"
85185,Brain lac NEC-deep coma,"Other and unspecified cerebral laceration and contusion, without mention of open intracranial wound, with prolonged [more than 24 hours] loss of consciousness without return to pre-existing conscious level"
E912,Resp obstr-inhal obj NEC,Inhalation and ingestion of other object causing obstruction of respiratory tract or suffocation
44031,Ath ext autologs bps gft,Atherosclerosis of autologous vein bypass graft of the extremities
73017,Chr osteomyelit-ankle,"Chronic osteomyelitis, ankle and foot"
6828,"Cellulitis, site NEC",Cellulitis and abscess of other specified sites
35800,Mysthna grvs w/o ac exac,Myasthenia gravis without (acute) exacerbation
83902,Disloc 2nd cerv vert-cl,"Closed dislocation, second cervical vertebra"
2384,Polycythemia vera,Polycythemia vera
57430,Choledocholith/ac gb inf,"Calculus of bile duct with acute cholecystitis, without mention of obstruction"
1882,Mal neo bladder-lateral,Malignant neoplasm of lateral wall of urinary bladder
59080,Pyelonephritis NOS,"Pyelonephritis, unspecified"
73739,Scoliosis NEC,Other kyphoscoliosis and scoliosis
V8525,"BMI 29.0-29.9,adult","Body Mass Index 29.0-29.9, adult"
V446,Urinostomy status NEC,Other artificial opening of urinary tract status
5991,Urethral fistula,Urethral fistula
E8528,Acc poison-sedatives NEC,Accidental poisoning by other specified sedatives and hypnotics
4011,Benign hypertension,Benign essential hypertension
V1072,Hx-hodgkin's disease,Personal history of hodgkin's disease
5579,Vasc insuff intest NOS,Unspecified vascular insufficiency of intestine
E8700,Acc cut/hem in surgery,"Accidental cut, puncture, perforation or hemorrhage during surgical operation"
8860,Amputation finger,"Traumatic amputation of other finger(s) (complete) (partial), without mention of complication"
E9198,Machinery accident NEC,Accidents caused by other specified machinery
4829,Bacterial pneumonia NOS,"Bacterial pneumonia, unspecified"
74782,Spinal vessel anomaly,Spinal vessel anomaly
V0261,Hepatitis B carrier,Hepatitis B carrier
8671,Bladder/urethra inj-open,"Injury to bladder and urethra, with open wound into cavity"
8240,Fx medial malleolus-clos,"Fracture of medial malleolus, closed"
1578,Malig neo pancreas NEC,Malignant neoplasm of other specified sites of pancreas
80121,Cl skul base fx w/o coma,"Closed fracture of base of skull with subarachnoid, subdural, and extradural hemorrhage, with no loss of consciousness"
87341,Open wound of cheek,"Open wound of cheek, without mention of complication"
88101,Open wound of elbow,"Open wound of elbow, without mention of complication"
70710,Ulcer of lower limb NOS,"Ulcer of lower limb, unspecified"
72291,Disc dis NEC/NOS-cerv,"Other and unspecified disc disorder, cervical region"
5168,Alveol pneumonopathy NEC,Other specified alveolar and parietoalveolar pneumonopathies
00869,Other viral intes infec,Enteritis due to other viral enteritis
4290,Myocarditis NOS,"Myocarditis, unspecified"
7135,Arthropathy w nerve dis,Arthropathy associated with neurological disorders
86511,Spleen hematoma-open,"Injury to spleen with open wound into cavity, hematoma without rupture of capsule"
E8191,Traffic acc NOS-pasngr,Motor vehicle traffic accident of unspecified nature injuring passenger in motor vehicle other than motorcycle
2250,Benign neoplasm brain,Benign neoplasm of brain
30002,Generalized anxiety dis,Generalized anxiety disorder
1830,Malign neopl ovary,Malignant neoplasm of ovary
8629,Intrathorac inj NOS-open,"Injury to multiple and unspecified intrathoracic organs, with open wound into cavity"
86415,Liver lacerat unspcf opn,"Injury to liver with open wound into cavity, laceration, unspecified"
86813,Peritoneum injury-open,"Injury to other intra-abdominal organs with open wound into cavity, peritoneum"
8750,Open wound of chest,"Open wound of chest (wall), without mention of complication"
E8152,Mv coll w oth obj-mocycl,Other motor vehicle traffic accident involving collision on the highway injuring motorcyclist
8601,Traum pneumothorax-open,Traumatic pneumothorax with open wound into thorax
8770,Open wound of buttock,"Open wound of buttock, without mention of complication"
8900,Open wound of hip/thigh,"Open wound of hip and thigh, without mention of complication"
25083,DMI oth uncntrld,"Diabetes with other specified manifestations, type I [juvenile type], uncontrolled"
V1255,Hx pulmonary embolism,Personal history of pulmonary embolism
E9444,Adv eff diuretics NEC,Other diuretics causing adverse effects in therapeutic use
27900,Hypogammaglobulinem NOS,"Hypogammaglobulinemia, unspecified"
79009,Abnormal RBC NEC,Other abnormality of red blood cells
40300,Mal hy kid w cr kid I-IV,"Hypertensive chronic kidney disease, malignant, with chronic kidney disease stage I through stage IV, or unspecified"
41002,"AMI anterolateral,subseq","Acute myocardial infarction of anterolateral wall, subsequent episode of care"
25090,DMII unspf nt st uncntrl,"Diabetes with unspecified complication, type II or unspecified type, not stated as uncontrolled"
20500,Ac myl leuk wo achv rmsn,"Acute myeloid leukemia, without mention of having achieved remission"
29592,Schizophrenia NOS-chr,"Unspecified schizophrenia, chronic"
57440,Choledochlith/gb inf NEC,"Calculus of bile duct with other cholecystitis, without mention of obstruction"
85301,Brain hem NEC w/o coma,"Other and unspecified intracranial hemorrhage following injury without mention of open intracranial wound, with no loss of consciousness"
E9361,Adv eff hydantoin deriv,Hydantoin derivatives causing adverse effects in therapeutic use
37200,Acute conjunctivitis NOS,"Acute conjunctivitis, unspecified"
1571,Mal neo pancreas body,Malignant neoplasm of body of pancreas
V444,Enterostomy status NEC,Status of other artificial opening of gastrointestinal tract
2373,Unc behav neo paragang,Neoplasm of uncertain behavior of paraganglia
2115,Ben neo liver/bile ducts,Benign neoplasm of liver and biliary passages
03819,Staphylcocc septicem NEC,Other staphylococcal septicemia
80707,Fracture seven ribs-clos,Closed fracture of seven ribs
2734,Alpha-1-antitrypsin def,Alpha-1-antitrypsin deficiency
V161,Fm hx-trach/bronchog mal,"Family history of malignant neoplasm of trachea, bronchus, and lung"
99657,Complcation-insulin pump,Mechanical complication due to insulin pump
51902,Tracheostomy - mech comp,Mechanical complication of tracheostomy
47874,Stenosis of larynx,Stenosis of larynx
4786,Edema of larynx,Edema of larynx
80021,Cl skull vlt fx w/o coma,"Closed fracture of vault of skull with subarachnoid, subdural, and extradural hemorrhage, with no loss of consciousness"
V553,Atten to colostomy,Attention to colostomy
7991,Respiratory arrest,Respiratory arrest
8603,Traum hemothorax-open,Traumatic hemothorax with open wound into thorax
8796,Open wound of trunk NEC,"Open wound of other and unspecified parts of trunk, without mention of complication"
9598,Injury mlt site/site NEC,"Other specified sites, including multiple injury"
8911,Open wnd knee/leg-compl,"Open wound of knee, leg [except thigh], and ankle, complicated"
7586,Gonadal dysgenesis,Gonadal dysgenesis
7786,Congenital hydrocele,Congenital hydrocele
43401,Crbl thrmbs w infrct,Cerebral thrombosis with cerebral infarction
44421,Upper extremity embolism,Arterial embolism and thrombosis of upper extremity
E9194,Woodworking machine acc,Accidents caused by woodworking and forming machines
30530,Hallucinog abuse-unspec,"Hallucinogen abuse, unspecified"
E8187,Mv traff acc NEC-pedest,Other noncollision motor vehicle traffic accident injuring pedestrian
76498,Fet grwth ret 2000-2499g,"Fetal growth retardation, unspecified, 2,000-2,499 grams"
2355,Unc behav neo GI NEC,Neoplasm of uncertain behavior of other and unspecified digestive organs
20002,Reticulosarcoma thorax,"Reticulosarcoma, intrathoracic lymph nodes"
29285,Drug induced sleep disor,Drug induced sleep disorders
6179,Endometriosis NOS,"Endometriosis, site unspecified"
7530,Renal agenesis,Renal agenesis and dysgenesis
41092,"AMI NOS, subsequent","Acute myocardial infarction of unspecified site, subsequent episode of care"
5120,Spont tens pneumothorax,Spontaneous tension pneumothorax
42983,Takotsubo syndrome,Takotsubo syndrome
80221,Fx condyl proc mandib-cl,"Closed fracture of mandible, condylar process"
80226,Fx symphy mandib body-cl,"Closed fracture of mandible, symphysis of body"
80227,Fx alveolar bord mand-cl,"Closed fracture of mandible, alveolar border of body"
E9580,Injury-moving object,Suicide and self-inflicted injury by jumping or lying before moving object
1560,Malig neo gallbladder,Malignant neoplasm of gallbladder
5755,Fistula of gallbladder,Fistula of gallbladder
36813,Visual discomfort,Visual discomfort
75450,Talipes varus,Talipes varus
V123,Hx-blood diseases,Personal history of diseases of blood and blood-forming organs
85201,Subarachnoid hem-no coma,"Subarachnoid hemorrhage following injury without mention of open intracranial wound, with no loss of consciousness"
80130,Cl skull base fx/hem NEC,"Closed fracture of base of skull with other and unspecified intracranial hemorrhage, unspecified state of consciousness"
76504,Extreme immat 1000-1249g,"Extreme immaturity, 1,000-1,249 grams"
74860,Lung anomaly NOS,"Anomaly of lung, unspecified"
9684,Pois-gen anesth NEC/NOS,Poisoning by other and unspecified general anesthetics
29284,Drug-induced mood disord,Drug-induced mood disorder
E8551,Acc poisn-cns depres NEC,Accidental poisoning by other central nervous system depressants
29211,Drug psych disor w delus,Drug-induced psychotic disorder with delusions
33392,Neuroleptic malgnt synd,Neuroleptic malignant syndrome
E8542,Acc poisn-psychstimulant,Accidental poisoning by psychostimulants
E9392,Adv eff butyrophen tranq,Butyrophenone-based tranquilizers causing adverse effects in therapeutic use
V298,NB obsrv oth suspct cond,Observation for other specified suspected conditions
47875,Laryngeal spasm,Laryngeal spasm
33391,Stiff-man syndrome,Stiff-man syndrome
4110,Post MI syndrome,Postmyocardial infarction syndrome
E8789,Abn react-surg proc NOS,"Unspecified surgical operations and procedures causing abnormal patient reaction, or later complication, without mention of misadventure at time of operation"
4659,Acute uri NOS,Acute upper respiratory infections of unspecified site
99769,Amputat stump compl NEC,Other amputation stump complication
43300,Ocl bslr art wo infrct,Occlusion and stenosis of basilar artery without mention of cerebral infarction
V1006,Hx-rectal & anal malign,"Personal history of malignant neoplasm of rectum, rectosigmoid junction, and anus"
9726,Pois-antihyperten agent,Poisoning by other antihypertensive agents
30490,Drug depend NOS-unspec,"Unspecified drug dependence, unspecified"
3898,Hearing loss NEC,Other specified forms of hearing loss
36274,Pigment retina dystrophy,Pigmentary retinal dystrophy
V1002,Hx-oral/pharynx malg NEC,Personal history of malignant neoplasm of other and unspecified oral cavity and pharynx
87352,Open wnd forehead-compl,"Open wound of forehead, complicated"
7841,Throat pain,Throat pain
30491,Drug depend NOS-contin,"Unspecified drug dependence, continuous"
E8261,Ped cycl acc-ped cyclist,Pedal cycle accident injuring pedal cyclist
34570,Epil par cont w/o int ep,"Epilepsia partialis continua, without mention of intractable epilepsy"
7626,Umbil cond NEC aff NB,Other and unspecified conditions of umbilical cord affecting fetus or newborn
72885,Spasm of muscle,Spasm of muscle
5690,Anal & rectal polyp,Anal and rectal polyp
E8493,Acc on industr premises,Accidents occurring in industrial places and premises
9053,Late eff femoral neck fx,Late effect of fracture of neck of femur
E969,Late effect assault,Late effects of injury purposely inflicted by other person
E8846,Fall from commode,Accidental fall from commode
4571,Other lymphedema,Other lymphedema
E8494,Accid in recreation area,Accidents occurring in place for recreation and sport
E8162,Loss control mv-mocycl,"Motor vehicle traffic accident due to loss of control, without collision on the highway, injuring motorcyclist"
80704,Fracture four ribs-close,Closed fracture of four ribs
5368,Stomach function dis NEC,Dyspepsia and other specified disorders of function of stomach
75739,Skin anomaly NEC,Other specified anomalies of skin
74405,Anomalies of inner ear,Anomalies of inner ear
74402,Ex ear anm NEC-impr hear,Other anomalies of external ear with impairment of hearing
4378,Cerebrovasc disease NEC,Other ill-defined cerebrovascular disease
2189,Uterine leiomyoma NOS,"Leiomyoma of uterus, unspecified"
6202,Ovarian cyst NEC/NOS,Other and unspecified ovarian cyst
2700,Amino-acid transport dis,Disturbances of amino-acid transport
2116,Benign neoplasm pancreas,"Benign neoplasm of pancreas, except islets of Langerhans"
80116,Cl skul base fx-coma NOS,"Closed fracture of base of skull with cerebral laceration and contusion, with loss of consciousness of unspecified duration"
80110,Cl skl base fx/cereb lac,"Closed fracture of base of skull with cerebral laceration and contusion, unspecified state of consciousness"
E8298,Oth rd veh acc-pers NEC,Other road vehicle accidents injuring other specified person
7534,Ureteral anomaly NEC,Other specified anomalies of ureter
43311,Ocl crtd art w infrct,Occlusion and stenosis of carotid artery with cerebral infarction
V301,Singl livebrn-before adm,"Single liveborn, born before admission to hospital"
42652,Rt bbb/lft ant fasc blk,Right bundle branch block and left anterior fascicular block
71595,Osteoarthros NOS-pelvis,"Osteoarthrosis, unspecified whether generalized or localized, pelvic region and thigh"
75563,Cong hip deformity NEC,Other congenital deformity of hip (joint)
9651,Poisoning-salicylates,Poisoning by salicylates
29623,Depress psychosis-severe,"Major depressive affective disorder, single episode, severe, without mention of psychotic behavior"
38832,Objective tinnitus,Objective tinnitus
V146,Hx-analgesic allergy,Personal history of allergy to analgesic agent
V4981,Asympt postmeno status,Asymptomatic postmenopausal status (age-related) (natural)
V151,Hx-major cardiovasc surg,"Personal history of surgery to heart and great vessels, presenting hazards to health"
8872,"Amput abv elbow, unilat","Traumatic amputation of arm and hand (complete) (partial), unilateral, at or above elbow, without mention of complication"
37555,Neonatal nasolacrml obst,"Obstruction of nasolacrimal duct, neonatal"
80422,Cl skl w oth fx-brf coma,"Closed fractures involving skull or face with other bones with subarachnoid, subdural, and extradural hemorrhage, with brief [less than one hour] loss of consciousness"
80506,Fx c6 vertebra-closed,Closed fracture of sixth cervical vertebra
5370,Acq pyloric stenosis,Acquired hypertrophic pyloric stenosis
3341,Hered spastic paraplegia,Hereditary spastic paraplegia
80435,Cl skul/oth fx-deep coma,"Closed fractures involving skull or face with other bones, with other and unspecified intracranial hemorrhage, with prolonged [more than 24 hours] loss of consciousness, without return to pre-existing conscious level"
E848,Oth vehicle acc NEC,"Accidents involving other vehicles, not elsewhere classifiable"
8731,Open wound scalp-compl,"Open wound of scalp, complicated"
7625,Oth umbil cord compress,Other compression of umbilical cord affecting fetus or newborn
81344,Fx low radius w ulna-cl,Closed fracture of lower end of radius with ulna
86600,Kidney injury NOS-closed,"Injury to kidney without mention of open wound into cavity, unspecified injury"
1539,Malignant neo colon NOS,"Malignant neoplasm of colon, unspecified site"
80320,Cl skl fx NEC/mening hem,"Other closed skull fracture with subarachnoid, subdural, and extradural hemorrhage, unspecified state of consciousness"
2167,Benign neo skin leg,"Benign neoplasm of skin of lower limb, including hip"
80842,Fracture ischium-closed,Closed fracture of ischium
E918,Caught between objects,Caught accidentally in or between objects
53200,Ac duodenal ulcer w hem,"Acute duodenal ulcer with hemorrhage, without mention of obstruction"
3568,Idio periph neurpthy NEC,Other specified idiopathic peripheral neuropathy
73018,Chr osteomyelit NEC,"Chronic osteomyelitis, other specified sites"
99603,Malfunc coron bypass grf,Mechanical complication due to coronary bypass graft
90229,Inj mesenteric vess NEC,"Injury to celiac and mesenteric arteries, other"
80706,Fracture six ribs-closed,Closed fracture of six ribs
81301,Fx olecran proc ulna-cl,Closed fracture of olecranon process of ulna
81500,Fx metacarpal NOS-closed,"Closed fracture of metacarpal bone(s), site unspecified"
87363,Broken tooth-uncomplic,"Open wound of tooth (broken) (fractured) (due to trauma), without mention of complication"
71430,Juv rheum arthritis NOS,"Polyarticular juvenile rheumatoid arthritis, chronic or unspecified"
2911,Alcohol amnestic disordr,Alcohol-induced persisting amnestic disorder
2849,Aplastic anemia NOS,"Aplastic anemia, unspecified"
82133,Supracondyl fx femur-opn,Open supracondylar fracture of femur
70713,Ulcer of ankle,Ulcer of ankle
5988,Urethral stricture NEC,Other specified causes of urethral stricture
28319,Oth nonauto hem anemia,Other non-autoimmune hemolytic anemias
71101,Pyogen arthritis-shlder,"Pyogenic arthritis, shoulder region"
73004,Ac osteomyelitis-hand,"Acute osteomyelitis, hand"
56731,Psoas muscle abscess,Psoas muscle abscess
7209,Inflam spondylopathy NOS,Unspecified inflammatory spondylopathy
V552,Atten to ileostomy,Attention to ileostomy
1509,Mal neo esophagus NOS,"Malignant neoplasm of esophagus, unspecified site"
V0259,Bacteria dis carrier NEC,Carrier or suspected carrier of other specified bacterial diseases
V1204,Hx Methicln resist Staph,Personal history of Methicillin resistant Staphylococcus aureus
7015,Abnormal granulation NEC,Other abnormal granulation tissue
48242,Meth res pneu d/t Staph,Methicillin resistant pneumonia due to Staphylococcus aureus
29650,Bipol I cur depres NOS,"Bipolar I disorder, most recent episode (or current) depressed, unspecified"
V1302,Personal history UTI,"Personal history, urinary (tract) infection"
226,Benign neoplasm thyroid,Benign neoplasm of thyroid glands
85182,Brain lac NEC-brief coma,"Other and unspecified cerebral laceration and contusion, without mention of open intracranial wound, with brief [less than one hour] loss of consciousness"
34580,Epilep NEC w/o intr epil,"Other forms of epilepsy and recurrent seizures, without mention of intractable epilepsy"
83401,Disloc metacarpophaln-cl,Closed dislocation of metacarpophalangeal (joint)
04149,E.coli infection NEC/NOS,Other and unspecified Escherichia coli [E. coli]
5225,Periapical abscess,Periapical abscess without sinus
V5413,Aftrcre traumatic fx hip,Aftercare for healing traumatic fracture of hip
7823,Edema,Edema
25042,DMII renal uncntrld,"Diabetes with renal manifestations, type II or unspecified type, uncontrolled"
3599,Myopathy NOS,"Myopathy, unspecified"
6929,Dermatitis NOS,"Contact dermatitis and other eczema, unspecified cause"
V5883,Therapeutic drug monitor,Encounter for therapeutic drug monitoring
85212,Op subarach hem-brf coma,"Subarachnoid hemorrhage following injury with open intracranial wound, with brief [less than one hour] loss of consciousness"
80102,Cl skul base fx-brf coma,"Closed fracture of base of skull without mention of intra cranial injury, with brief [less than one hour] loss of consciousness"
9211,Contusion periocular,Contusion of eyelids and periocular area
80841,Fracture of ilium-closed,Closed fracture of ilium
3102,Postconcussion syndrome,Postconcussion syndrome
1892,Malign neopl ureter,Malignant neoplasm of ureter
86344,Sigmoid colon inj-closed,"Injury to sigmoid colon, without mention of open wound into cavity"
7993,Debility NOS,"Debility, unspecified"
80114,Cl skl base fx-prol coma,"Closed fracture of base of skull with cerebral laceration and contusion, with prolonged [more than 24 hours] loss of consciousness and return to pre-existing conscious level"
E8348,W/crft fall NEC-pers NEC,Other fall from one level to another in water transport injuring other specified person
47830,Vocal cord paralysis NOS,"Paralysis of vocal cords or larynx, unspecified"
75567,Anomalies of foot NEC,"Anomalies of foot, not elsewhere classified"
43882,Late ef CV dis dysphagia,"Other late effects of cerebrovascular disease, dysphagia"
3574,Neuropathy in other dis,Polyneuropathy in other diseases classified elsewhere
99771,Vasc comp mesenteric art,Vascular complications of mesenteric artery
7197,Difficulty in walking,Difficulty in walking
72972,Nontraum comp syn-low ex,Nontraumatic compartment syndrome of lower extremity
2861,Cong factor IX disorder,Congenital factor IX disorder
7484,Congenital cystic lung,Congenital cystic lung
24201,Tox dif goiter w crisis,Toxic diffuse goiter with mention of thyrotoxic crisis or storm
1968,Mal neo lymph node-mult,Secondary and unspecified malignant neoplasm of lymph nodes of multiple sites
1921,Mal neo cerebral mening,Malignant neoplasm of cerebral meninges
E9363,Adv eff antconvl NEC/NOS,Other and unspecified anticonvulsants causing adverse effects in therapeutic use
4253,Endocard fibroelastosis,Endocardial fibroelastosis
E9429,Adv eff cardiovasc NEC,Other and unspecified agents primarily affecting the cardiovascular system causing adverse effects in therapeutic use
76496,Fet grwth ret 1500-1749g,"Fetal growth retardation, unspecified, 1,500-1,749 grams"
59010,Ac pyelonephritis NOS,Acute pyelonephritis without lesion of renal medullary necrosis
56201,Dvrtcli sml int w/o hmrg,Diverticulitis of small intestine (without mention of hemorrhage)
2949,Mental disor NOS oth dis,Unspecified persistent mental disorders due to conditions classified elsewhere
1648,Mal neo mediastinum NEC,Malignant neoplasm of other parts of mediastinum
7621,Placenta hem NEC aff NB,Other forms of placental separation and hemorrhage affecting fetus or newborn
E9443,Adv eff saluretics,Saluretics causing adverse effects in therapeutic use
59654,Neurogenic bladder NOS,Neurogenic bladder NOS
6820,Cellulitis of face,Cellulitis and abscess of face
035,Erysipelas,Erysipelas
76521,<24 comp wks gestation,Less than 24 completed weeks of gestation
V1749,Fam hx-cardiovas dis NEC,Family history of other cardiovascular diseases
1713,Mal neo soft tissue leg,"Malignant neoplasm of connective and other soft tissue of lower limb, including hip"
71906,Joint effusion-l/leg,"Effusion of joint, lower leg"
73734,Thoracogenic scoliosis,Thoracogenic scoliosis
7384,Acq spondylolisthesis,Acquired spondylolisthesis
9051,Late eff spine/trunk fx,Late effect of fracture of spine and trunk without mention of spinal cord lesion
5193,Mediastinum disease NEC,"Other diseases of mediastinum, not elsewhere classified"
220,Benign neoplasm ovary,Benign neoplasm of ovary
4779,Allergic rhinitis NOS,"Allergic rhinitis, cause unspecified"
79311,Solitary pulmonry nodule,Solitary pulmonary nodule
2127,Benign neoplasm heart,Benign neoplasm of heart
60091,BPH NOS w ur obs/LUTS,"Hyperplasia of prostate, unspecified, with urinary obstruction and other lower urinary symptoms (LUTS)"
22802,Hemangioma intracranial,Hemangioma of intracranial structures
99883,Non-healing surgcl wound,Non-healing surgical wound
1725,Malig melanoma trunk,"Malignant melanoma of skin of trunk, except scrotum"
99779,Vascular comp vessel NEC,Vascular complications of other vessels
V5489,Orthopedic aftercare NEC,Other orthopedic aftercare
75479,Cong foot deform NEC,Other deformities of feet
71691,Arthropathy NOS-shlder,"Arthropathy, unspecified, shoulder region"
7262,Shoulder region dis NEC,"Other affections of shoulder region, not elsewhere classified"
42971,Acq cardiac septl defect,Acquired cardiac septal defect
7458,Septal closure anom NEC,Other bulbus cordis anomalies and anomalies of cardiac septal closure
74749,Great vein anomaly NEC,Other anomalies of great veins
E8197,Traffic acc NOS-pedest,Motor vehicle traffic accident of unspecified nature injuring pedestrian
56982,Ulceration of intestine,Ulceration of intestine
56969,Colstmy/enteros comp NEC,Other colostomy and enterostomy complication
9658,Pois-analges/antipyr NEC,Poisoning by other specified analgesics and antipyretics
